{
  "$schema": "https://json-schema.org/draft/2020-12/schema",
  "type": "object",
  "properties": {
    "$schema": {
      "description": "Editor hint: path to the JSON Schema of this file.",
      "type": "string"
    },
    "id": {
      "type": "string",
      "format": "uuid",
      "pattern": "^([0-9a-fA-F]{8}-[0-9a-fA-F]{4}-4[0-9a-fA-F]{3}-[89abAB][0-9a-fA-F]{3}-[0-9a-fA-F]{12})$",
      "description": "Stable lowercase UUID v4 identity of the element. Assigned by tooling at creation and never reused; a rename keeps it."
    },
    "name": {
      "type": "string",
      "pattern": "^[A-Z][A-Za-z0-9]*$",
      "description": "Logical object name in PascalCase."
    },
    "physicalName": {
      "type": "string",
      "minLength": 1,
      "description": "Physical database name. Assigned once at creation and never changed, so a rename emits no DDL. At most 63 bytes in UTF-8."
    },
    "schema": {
      "description": "PostgreSQL schema of the object; the project defaultSchema applies when absent.",
      "type": "string"
    },
    "scope": {
      "description": "Scope kind of the object, or none to keep it outside any scope. Required when the project declares scope kinds.",
      "type": "string"
    },
    "title": {
      "description": "Human-readable title of the object.",
      "type": "object",
      "properties": {
        "uk": {
          "description": "Ukrainian text.",
          "type": "string"
        },
        "en": {
          "description": "English text.",
          "type": "string"
        }
      },
      "additionalProperties": false
    },
    "description": {
      "description": "Description of the object.",
      "type": "object",
      "properties": {
        "uk": {
          "description": "Ukrainian text.",
          "type": "string"
        },
        "en": {
          "description": "English text.",
          "type": "string"
        }
      },
      "additionalProperties": false
    },
    "kind": {
      "type": "string",
      "const": "Constant",
      "description": "Metadata kind; always Constant."
    },
    "kindLabel": {
      "description": "Physical kind label of the object. Assigned once at creation and never changed, so a rename keeps it.",
      "type": "string",
      "minLength": 1
    },
    "publicRead": {
      "description": "API role that may read every row of the object: authenticated users or anonymous visitors. Absent means no public read.",
      "type": "string",
      "enum": [
        "authenticated",
        "anon"
      ]
    },
    "customActions": {
      "default": [],
      "description": "Custom actions of the object beyond the standard actions of its kind.",
      "type": "array",
      "items": {
        "type": "object",
        "properties": {
          "id": {
            "type": "string",
            "format": "uuid",
            "pattern": "^([0-9a-fA-F]{8}-[0-9a-fA-F]{4}-4[0-9a-fA-F]{3}-[89abAB][0-9a-fA-F]{3}-[0-9a-fA-F]{12})$",
            "description": "Stable lowercase UUID v4 identity of the element. Assigned by tooling at creation and never reused; a rename keeps it."
          },
          "name": {
            "type": "string",
            "pattern": "^[A-Za-z][A-Za-z0-9_]*$",
            "description": "Logical name of the custom action, camelCase like the standard action words; must not repeat a standard action of the kind."
          },
          "requires": {
            "default": [],
            "description": "Actions a holder of this action must also hold: standard action words of the kind or names of custom actions of the same object.",
            "type": "array",
            "items": {
              "type": "string",
              "pattern": "^[A-Za-z][A-Za-z0-9_]*$",
              "description": "Logical element name (attribute, section, column). The casing style is checked against the project naming setting."
            }
          },
          "effects": {
            "default": {},
            "description": "What the action writes itself; an action that writes anything is an update.",
            "type": "object",
            "properties": {
              "header": {
                "description": "Header columns the action writes: all, or logical names of attributes and standard attributes of the object.",
                "anyOf": [
                  {
                    "type": "string",
                    "const": "all"
                  },
                  {
                    "type": "array",
                    "items": {
                      "type": "string",
                      "pattern": "^[A-Za-z][A-Za-z0-9_]*$",
                      "description": "Logical element name (attribute, section, column). The casing style is checked against the project naming setting."
                    }
                  }
                ]
              },
              "tabularSections": {
                "description": "Whether the action writes the tabular section rows.",
                "type": "boolean"
              }
            },
            "additionalProperties": false
          }
        },
        "required": [
          "name"
        ],
        "additionalProperties": false
      }
    },
    "type": {
      "type": "string",
      "enum": [
        "UUID",
        "String",
        "Text",
        "Integer",
        "SmallInt",
        "BigInt",
        "Numeric",
        "Boolean",
        "Date",
        "DateTime",
        "Bytes",
        "Json",
        "Ref"
      ],
      "description": "Logical value type."
    },
    "length": {
      "description": "Maximum length; required for String and allowed only there.",
      "type": "integer",
      "exclusiveMinimum": 0,
      "maximum": 9007199254740991
    },
    "precision": {
      "description": "Total number of digits; allowed only for Numeric.",
      "type": "integer",
      "exclusiveMinimum": 0,
      "maximum": 9007199254740991
    },
    "scale": {
      "description": "Digits after the decimal point; requires precision.",
      "type": "integer",
      "minimum": 0,
      "maximum": 9007199254740991
    },
    "ref": {
      "description": "Single reference target of a Ref value; mutually exclusive with allowedTypes.",
      "type": "object",
      "properties": {
        "kind": {
          "type": "string",
          "enum": [
            "Catalog",
            "Document",
            "Enumeration",
            "InformationRegister",
            "AccumulationRegister",
            "Constant",
            "CustomTable",
            "PgEnum",
            "EventSubscription"
          ],
          "description": "Kind of the referenced metadata object."
        },
        "name": {
          "type": "string",
          "pattern": "^[A-Z][A-Za-z0-9]*$",
          "description": "Logical name of the referenced object."
        }
      },
      "required": [
        "kind",
        "name"
      ],
      "additionalProperties": false
    },
    "allowedTypes": {
      "description": "Polymorphic reference targets of a Ref value; mutually exclusive with ref.",
      "minItems": 1,
      "type": "array",
      "items": {
        "type": "object",
        "properties": {
          "kind": {
            "type": "string",
            "enum": [
              "Catalog",
              "Document",
              "Enumeration",
              "InformationRegister",
              "AccumulationRegister",
              "Constant",
              "CustomTable",
              "PgEnum",
              "EventSubscription"
            ],
            "description": "Kind of the referenced metadata object."
          },
          "name": {
            "type": "string",
            "pattern": "^[A-Z][A-Za-z0-9]*$",
            "description": "Logical name of the referenced object."
          }
        },
        "required": [
          "kind",
          "name"
        ],
        "additionalProperties": false,
        "description": "Reference to a metadata object by kind and logical name; the compiler resolves it to an id."
      }
    },
    "array": {
      "description": "Whether the value is an array of the type.",
      "type": "boolean"
    },
    "crossScope": {
      "description": "Marks a deliberately cross-scope Ref: the FK has no scope part in its key.",
      "type": "boolean",
      "const": true
    },
    "defaultValue": {
      "description": "Initial value of the constant.",
      "anyOf": [
        {
          "type": "string"
        },
        {
          "type": "number"
        },
        {
          "type": "boolean"
        },
        {
          "type": "object",
          "properties": {
            "fill": {
              "type": "string",
              "enum": [
                "now",
                "today",
                "newUuid"
              ],
              "description": "Fill expression computed by the database: now (DateTime), today (Date), newUuid (UUID)."
            }
          },
          "required": [
            "fill"
          ],
          "additionalProperties": false
        },
        {
          "type": "object",
          "properties": {
            "empty": {
              "anyOf": [
                {
                  "type": "boolean",
                  "const": true
                },
                {
                  "type": "string",
                  "enum": [
                    "object",
                    "array"
                  ]
                }
              ],
              "description": "Empty value: true for an array of any type, object or array for a scalar Json."
            }
          },
          "required": [
            "empty"
          ],
          "additionalProperties": false
        }
      ]
    }
  },
  "required": [
    "name",
    "kind",
    "type"
  ],
  "additionalProperties": false,
  "$id": "constants.schema.json"
}
